{
  "schema_version": "1.0",
  "generated_at": "2026-04-09T22:20:00",
  "company": {
    "name": "테스트전자부품(주)",
    "business_no": "123-45-67890",
    "corporate_no": null,
    "stock_code": null,
    "dart_code": null,
    "listed": false,
    "ksic_code": "C262",
    "ksic_name": "반도체 및 전자부품 제조업",
    "size_code": "M",
    "size_label": "중소기업",
    "ceo": "김대표",
    "established": "2012-03-15",
    "employees": 48,
    "address": "경기도 성남시 분당구 판교로 123",
    "website": "https://example.co.kr"
  },
  "statements": [
    {
      "fiscal_year": 2022,
      "period_start": "2022-01-01",
      "period_end": "2022-12-31",
      "report_type": "separate",
      "accounting_standard": "K-GAAP",
      "currency": "KRW",
      "unit": "원",
      "audit": {
        "opinion": "적정",
        "auditor": "정직회계법인",
        "report_date": "2023-03-20",
        "going_concern_doubt": false
      },
      "balance_sheet": {
        "current_assets": 4820000000,
        "non_current_assets": 3580000000,
        "total_assets": 8400000000,
        "current_liabilities": 3150000000,
        "non_current_liabilities": 1820000000,
        "total_liabilities": 4970000000,
        "total_equity": 3430000000,
        "cash_and_equivalents": 780000000,
        "trade_receivables": 2100000000,
        "inventories": 1450000000,
        "ppe": 2950000000,
        "intangibles": 180000000,
        "short_term_debt": 1200000000,
        "long_term_debt": 1500000000,
        "trade_payables": 980000000,
        "paid_in_capital": 500000000,
        "retained_earnings": 2830000000
      },
      "income_statement": {
        "revenue": 12800000000,
        "cost_of_sales": 9850000000,
        "gross_profit": 2950000000,
        "sga": 2380000000,
        "operating_profit": 570000000,
        "finance_cost": 145000000,
        "interest_expense": 135000000,
        "profit_before_tax": 415000000,
        "income_tax": 92000000,
        "net_profit": 323000000,
        "depreciation": 280000000,
        "amortization": 35000000,
        "rnd_expense": 720000000
      },
      "cash_flow": {
        "operating_cf": 680000000,
        "investing_cf": -420000000,
        "financing_cf": -180000000,
        "net_cf": 80000000,
        "capex": 410000000,
        "interest_paid": 135000000,
        "dividends_paid": 50000000
      },
      "quality": {
        "source": "pdf",
        "source_file": "2022_감사보고서.pdf",
        "extraction_confidence": 0.94,
        "missing_fields": [],
        "low_confidence_fields": ["rnd_expense"],
        "warnings": ["단위 변환: 백만원 → 원"],
        "extracted_at": "2026-04-09T22:00:00"
      }
    },
    {
      "fiscal_year": 2023,
      "period_start": "2023-01-01",
      "period_end": "2023-12-31",
      "report_type": "separate",
      "accounting_standard": "K-GAAP",
      "currency": "KRW",
      "unit": "원",
      "audit": {
        "opinion": "적정",
        "auditor": "정직회계법인",
        "report_date": "2024-03-18",
        "going_concern_doubt": false
      },
      "balance_sheet": {
        "current_assets": 5680000000,
        "non_current_assets": 3920000000,
        "total_assets": 9600000000,
        "current_liabilities": 3850000000,
        "non_current_liabilities": 2050000000,
        "total_liabilities": 5900000000,
        "total_equity": 3700000000,
        "cash_and_equivalents": 620000000,
        "trade_receivables": 2890000000,
        "inventories": 1780000000,
        "ppe": 3180000000,
        "intangibles": 195000000,
        "short_term_debt": 1650000000,
        "long_term_debt": 1550000000,
        "trade_payables": 1120000000,
        "paid_in_capital": 500000000,
        "retained_earnings": 3100000000
      },
      "income_statement": {
        "revenue": 14200000000,
        "cost_of_sales": 11020000000,
        "gross_profit": 3180000000,
        "sga": 2680000000,
        "operating_profit": 500000000,
        "finance_cost": 185000000,
        "interest_expense": 178000000,
        "profit_before_tax": 325000000,
        "income_tax": 72000000,
        "net_profit": 253000000,
        "depreciation": 310000000,
        "amortization": 38000000,
        "rnd_expense": 810000000
      },
      "cash_flow": {
        "operating_cf": 490000000,
        "investing_cf": -560000000,
        "financing_cf": 150000000,
        "net_cf": 80000000,
        "capex": 550000000,
        "interest_paid": 178000000,
        "dividends_paid": 0
      },
      "quality": {
        "source": "pdf",
        "source_file": "2023_감사보고서.pdf",
        "extraction_confidence": 0.96,
        "missing_fields": [],
        "low_confidence_fields": [],
        "warnings": ["단위 변환: 백만원 → 원"],
        "extracted_at": "2026-04-09T22:00:00"
      }
    },
    {
      "fiscal_year": 2024,
      "period_start": "2024-01-01",
      "period_end": "2024-12-31",
      "report_type": "separate",
      "accounting_standard": "K-GAAP",
      "currency": "KRW",
      "unit": "원",
      "audit": {
        "opinion": "적정",
        "auditor": "정직회계법인",
        "report_date": "2025-03-22",
        "going_concern_doubt": false
      },
      "balance_sheet": {
        "current_assets": 6450000000,
        "non_current_assets": 4180000000,
        "total_assets": 10630000000,
        "current_liabilities": 4680000000,
        "non_current_liabilities": 2020000000,
        "total_liabilities": 6700000000,
        "total_equity": 3930000000,
        "cash_and_equivalents": 510000000,
        "trade_receivables": 3620000000,
        "inventories": 1950000000,
        "ppe": 3410000000,
        "intangibles": 205000000,
        "short_term_debt": 2100000000,
        "long_term_debt": 1500000000,
        "trade_payables": 1320000000,
        "paid_in_capital": 500000000,
        "retained_earnings": 3330000000
      },
      "income_statement": {
        "revenue": 15100000000,
        "cost_of_sales": 11820000000,
        "gross_profit": 3280000000,
        "sga": 2880000000,
        "operating_profit": 400000000,
        "finance_cost": 245000000,
        "interest_expense": 238000000,
        "profit_before_tax": 185000000,
        "income_tax": 38000000,
        "net_profit": 147000000,
        "depreciation": 340000000,
        "amortization": 42000000,
        "rnd_expense": 890000000
      },
      "cash_flow": {
        "operating_cf": 180000000,
        "investing_cf": -610000000,
        "financing_cf": 320000000,
        "net_cf": -110000000,
        "capex": 600000000,
        "interest_paid": 238000000,
        "dividends_paid": 0
      },
      "quality": {
        "source": "pdf",
        "source_file": "2024_감사보고서.pdf",
        "extraction_confidence": 0.93,
        "missing_fields": [],
        "low_confidence_fields": ["rnd_expense"],
        "warnings": ["단위 변환: 백만원 → 원", "매출채권 급증 감지"],
        "extracted_at": "2026-04-09T22:00:00"
      }
    }
  ]
}
